{"adopted_for_execution":false,"bindings":[{"sha256":"590d8d196522078dc047eaa5e1c0a03e0ff93313719e2f6f2d10e9ed6be08c61","uri":"control/armindex/a1.2/execution-contract.live-preflight-repair.v7.json"},{"sha256":"8790fca3ff8a5d4a0cdfa19d41c0534df00b3ae6d2597455b89b290ba4f39edd","uri":"campaigns/armindex-multiretriever-v2/evidence/a1.2-live-preflight-repair.receipt.v7.json"},{"sha256":"28402c57d22400b343cdc94ef88aa285ce94eedf3cb44680c9679c6be9654acd","uri":"control/armindex/a1.2/owner-instance-continuation-policy.v1.json"},{"sha256":"142d78db8e1407cad23385e7e837ee3e50383e4914818190f53c73b3cc045d67","uri":"scripts/a1_2_vast/Invoke-A12VastDirectBaseCoordinatorV8.ps1"},{"sha256":"a573987e368a325534e05c15cf3a8b3ed6b3d6f800d3120e4231a0c989fa9c6f","uri":"scripts/a1_2_vast/remote-bootstrap-direct-base-v7.sh"},{"sha256":"d01f70b7c4a1abdacf6b5045876cbd011010104643dda594f9c8b84a5ba499e4","uri":"scripts/a1_2_vast/remote-bootstrap-direct-base-v8.sh"},{"sha256":"8eab91cf0082dc1f165c17183016b4a8c5a3b971cbe91bcd0b973dc71b19a3fd","uri":"docs/operations/A1_2_VAST_4X3090_OWNER_RUNBOOK_V8.md"},{"sha256":"eadce7b35347d8fb57df9e2e83b2cdcbb62f41671eee6544acaaab8a7223f3f9","uri":"schemas/armindex/a1.2-live-preflight-packaging-repair.v8.json"},{"sha256":"2f33493e979d227839b2aca0a4be2a51302fca06e70a5f706ca3d39491cc3ccc","uri":"src/myis_research/armindex/a1_2_live_preflight_packaging_v8.py"}],"charged_usd":0,"claim_boundary":"same-instance synthetic packaging repair only; no measured retrieval","contract_sha256":"d46193a975a7d3afdb3c6a3b5c038157e6bd246458bc054c043adc80c45ac020","evidence_class":"live_engineering_preflight_packaging_repair","final_accesses":0,"launch_allowed":false,"measured_runs":0,"new_remote_root":"/opt/myis/a1.2-v8","preserved_live_failure_ids":["v6-initial-wheelhouse-missing-pydantic","v6-supplement-repair-mutated-pycache-tree","v7-frozen-bundle-missing-validation-lineage"],"receipt_id":"a1.2-live-preflight-validation-complete-bundle-v8","receipt_sha256":"7cc3adb3f454b9ab7911270cfef9cb17863f39292d644b18396bf285af98b6b5","revision_id":"a1.2-live-preflight-validation-complete-bundle-v8","schema_version":"myis.armindex-a1.2-live-preflight-packaging-repair.v8","scientific_authority":false,"selection_accesses":0,"status":"validation_complete_bundle_repair_prepared_preflight_pending","v7_receipt_sha256":"8790fca3ff8a5d4a0cdfa19d41c0534df00b3ae6d2597455b89b290ba4f39edd","validation_lineage_complete":true}
